"Messagekey","Comment","Comment"
"late-today","Arrived late today","วันนี้มาสาย"
"late-yesterday","Arrived late yesterday","เมื่อวานนี้มาสาย"
"ontime-today","Arrived on time today","วันนี้มาตรงเวลา"
"ontime-yesterday","Arrived on time yesterday","เมื่อวานนี้มาตรงเวลา"
"cannottest","Cannot test until incomplete assignments are finished","ไม่สามารถทำการสอบได้จนกว่าจะทำงานที่ได้รับมอบหมายซึ่งคงค้างอยู่สำเร็จเรียบร้อย"
"chewedgum","Chewed gum in class","เคี้ยวหมากฝรั่งในห้องเรียน"
"completedweek","Completed all of the week's assignments on time","ทำงานที่ได้รับมอบหมายของสัปดาห์นี้เสร็จตรงเวลา"
"completedwork","Completed all required work on time","ทำงานที่กำหนดเสร็จตรงเวลา"
"contributedproject","Contributed to the class project","มีส่วนร่วมในโครงงานวิชา"
"contributeddiscussion","Contributed to the discussion","มีส่วนร่วมในการอภิปราย"
"cooperated","Cooperated and followed directions","ให้ความร่วมมือและปฏิบัติตามคำสั่ง"
"eagernesstolearn","Demonstrated eagerness to learn","แสดงความกระตือรือล้นในการเรียนรู้"
"pooreffort","Demonstrated poor effort in class","ไม่แสดงความพยายามในชั้นเรียน"
"notcompleteproject","Did not complete the class project","ทำโครงงานวิชาไม่เสร็จ"
"notmuchwork","Did not do much work in class today","วันนี้ทำงานในชั้นเรียนไม่มาก"
"notfollowdirection","Did not follow directions","ไม่ปฏิบัติตามคำสั่ง"
"missinghomework","Did not turn in a required homework assignment","ไม่ส่งการบ้านที่ได้รับมอบหมายตามกำหนด"
"missingmultiplehomework","Did not turn in multiple required homework assignments","ไม่ส่งการบ้านที่ได้รับมอบหมายตามกำหนดหลายรายการ"
"notwearuniform","Did not wear the school uniform","ไม่สวมเครื่องแบบนักเรียน"
"notworkwell","Did not work well with others","ทำงานร่วมกับผู้อื่นได้ไม่ดี"
"disobeyed","Disobeyed the teacher","ไม่เชื่อฟังคุณครู"
"goodbehavior","Displayed good behavior","มีความประพฤติดี"
"distrupted","Disrupted the learning of others","รบกวนการเรียนรู้ของผู้อื่น"
"excell-algebra","Excelled at algebra","เก่งพีชคณิต"
"excell-art","Excelled at art","เก่งศิลปะ"
"excell-english","Excelled at English","เก่งภาษาอังกฤษ"
"excell-frensh","Excelled at French","เก่งภาษาฝรั่งเศส"
"excell-geometry","Excelled at geometry","เก่งเรขาคณิต"
"excell-math","Excelled at math","เก่งคณิตศาสตร์"
"excell-spanish","Excelled at Spanish","เก่งภาษาสเปน"
"excell-spelling","Excelled at spelling","เก่งในการสะกดคำ"
"excell-writing","Excelled at writing","เก่งในการเขียน"
"greateattitude","Had a great attitude","มีทัศนคติที่ดี"
"cellphone","Had a mobile phone in violation of school policy","มีโทรศัพท์มือถือซึ่งเป็นการละเมิดนโยบายของโรงเรียน"
"fieldtrip-friday","Has a field trip Friday","มีทัศนศึกษาวันศุกร์"
"fieldtripform-friday","Has a field trip Friday. Please return the signature form.","มีทัศนศึกษาวันศุกร์ กรุณาคืนแบบฟอร์มที่ให้ผู้ปกครองเซ็นต์รับทราบ"
"fieldtrip-monday","Has a field trip Monday","มีทัศนศึกษาวันจันทร์"
"fieldtripform-monday","Has a field trip Monday. Please return the signature form.","มีทัศนศึกษาวันจันทร์ กรุณาคืนแบบฟอร์มที่ให้ผู้ปกครองเซ็นต์รับทราบ"
"fieldtrip-nextfriday","Has a field trip next Friday","มีทัศนศึกษาวันศุกร์หน้า"
"fieldtripform-nextfriday","Has a field trip next Friday. Please return the signature form.","มีทัศนศึกษาวันศุกร์หน้า กรุณาคืนแบบฟอร์มที่ให้ผู้ปกครองเซ็นต์รับทราบ"
"Fieldtrip-nextmonday","Has a field trip next Monday","มีทัศนศึกษาวันจันทร์หน้า"
"fieldtripform-nextmonday","Has a field trip next Monday. Please return the signature form.","มีทัศนศึกษาวันจันทร์หน้า กรุณาคืนแบบฟอร์มที่ให้ผู้ปกครองเซ็นต์รับทราบ"
"fieldtrip-nextthursday","Has a field trip next Thursday","มีทัศนศึกษาวันพฤหัสบดีหน้า"
"fieldtripform-nextthursday","Has a field trip next Thursday. Please return the signature form.","มีทัศนศึกษาวันพฤหัสบดีหน้า กรุณาคืนแบบฟอร์มที่ให้ผู้ปกครองเซ็นต์รับทราบ"
"fieldtrip-nexttuesday","Has a field trip next Tuesday","มีทัศนศึกษาวันอังคารหน้า"
"fieldtripform-nexttuesday","Has a field trip next Tuesday. Please return the signature form.","มีทัศนศึกษาวันอังคารหน้า กรุณาคืนแบบฟอร์มที่ให้ผู้ปกครองเซ็นต์รับทราบ"
"fieldtrip-nextwednesday","Has a field trip next Wednesday","มีทัศนศึกษาวันพุธหน้า"
"fieldtripform-nextwednesday","Has a field trip next Wednesday. Please return the signature form.","มีทัศนศึกษาวันพุธหน้า กรุณาคืนแบบฟอร์มที่ให้ผู้ปกครองเซ็นต์รับทราบ"
"fieldtrip-thursday","Has a field trip Thursday","มีทัศนศึกษาวันพฤหัสบดี"
"fieldtripform-thursday","Has a field trip Thursday. Please return the signature form.","มีทัศนศึกษาวันพฤหัสบดีหน้า กรุณาคืนแบบฟอร์มที่ให้ผู้ปกครองเซ็นต์รับทราบ"
"fieldtrip-tuesday","Has a field trip Tuesday","มีทัศนศึกษาวันอังคาร"
"fieldtripform-tuesday","Has a field trip Tuesday. Please return the signature form.","มีทัศนศึกษาวันอังคาร กรุณาคืนแบบฟอร์มที่ให้ผู้ปกครองเซ็นต์รับทราบ"
"fieldtrip-wednesday","Has a field trip Wednesday","มีทัศนศึกษาวันพุธ"
"fieldtripform-wednesday","Has a field trip Wednesday. Please return the signature form.","มีทัศนศึกษาวันพุธ กรุณาคืนแบบฟอร์มที่ให้ผู้ปกครองเซ็นต์รับทราบ"
"projectdue-friday","Has a project due Friday","กำหนดส่งโครงงานวันศุกร์"
"projectdue-nextweek","Has a project due in one week","กำหนดส่งโครงงานอีกหนึ่งสัปดาห์"
"projectdue-monday","Has a project due Monday","กำหนดส่งโครงงานวันจันทร์"
"projectdue-nextfriday","Has a project due next Friday","กำหนดส่งโครงงานวันศุกร์หน้า"
"projectdue-nextmonday","Has a project due next Monday","กำหนดส่งโครงงานวันจันทร์หน้า"
"projectdue-nextthurday","Has a project due next Thursday","กำหนดส่งโครงงานวันพฤหัสบดีหน้า"
"projectdue-nexttuesday","Has a project due next Tuesday","กำหนดส่งโครงงานวันอังคารหน้า"
"projectdue-nextwednesday","Has a project due next Wednesday","กำหนดส่งโครงงานวันพุธหน้า"
"projectdue-thursday","Has a project due Thursday","กำหนดส่งโครงงานวันพฤหัสบดี"
"projectdue-tuesday","Has a project due Tuesday","กำหนดส่งโครงงานวันอังคาร"
"projectdue-wednesday","Has a project due Wednesday","กำหนดส่งโครงงานวันพุธ"
"balancestudentservices","Has an overdue balance with student services","มียอดค้างชำระที่เลยกำหนดกับฝ่ายบริการนักเรียน"
"balancenutrition","Has an overdue balance with the child nutrition department","มียอดค้างชำระที่เลยกำหนดกับแผนกโภชนาการเด็ก"
"balancelibrary","Has an overdue balance with the library","มียอดค้างชำระที่เลยกำหนดกับห้องสมุด"
"absent5","Has been absent from class five or more times","ขาดเรียนห้าครั้งหรือมากกว่านั้น"
"absent7","Has been absent from class seven or more times","ขาดเรียนเจ็ดครั้งครั้งหรือมากกว่านั้น"
"absent3","Has been absent from class three or more times","ขาดเรียนสามครั้งหรือมากกว่านั้น"
"awardmonth","Has been awarded student of the month","ได้รับเลือกเป็นนักเรียนดีเด่นประจำเดือน"
"awardweek","Has been awarded student of the week","ได้รับเลือกเป็นนักเรียนดีเด่นประจำสัปดาห์"
"academicprobation","Has been given academic probation","ได้รับการภาคทัณฑ์"
"tutoring","Has been recommended for tutoring","ได้รับคำแนะำนำให้กวดวิชา"
"lowergrade","Has dropped by one letter grade in class","เกรดในชั้นเรียนลดไปหนึ่งเกรด"
"extracredit","Has an extra credit assignment","ได้รับคะแนนสำหรับงานที่ได้รับมอบหมายเป็นพิเศษ"
"gradingsheet","Has had a grading sheet sent home","ได้มีการส่งใบรายงานคะแนนไปให้ทางบ้าน"
"reportcard","Has had a report card sent home","ได้มีการส่งสมุดรายงานผลการเรียนไปให้ทางบ้าน"
"bettergrade","Has improved by one letter grade in class","เกรดในชั้นเรียนได้พัฒนาเพิ่มขึ้นไปหนึ่งเกรด"
"workedhard","Has worked hard and is improving performance","ขยันและมีการพัฒนาผลเรียน"
"helped","Helped the teacher","ช่วยเหลือครู"
"improved-algebra","Improved algebra skills","มีพัฒนาการทักษะด้านพีชคณิต"
"improved-geometry","Improved geometry skills","มีพัฒนาการทักษะด้านเรขาคณิต"
"improved-handwriting","Improved handwriting skills","มีพัฒนาการทักษะด้านลายมือ"
"improved-language","Improved language skills","มีพัฒนาการทักษะด้านภาษา"
"improved-math","Improved math skills","มีพัฒนาการทักษะด้านคณิตศาสตร์"
"improved-spelling","Improved spelling skills","มีพัฒนาการทักษะด้านการสะกดคำ"
"topperformer","Is a top performer in class","เก่งที่สุดในชั้นเรียน"
"riskgraduating","Is at risk of not graduating","เสี่ยงต่อการไม่จบการศึกษา"
"riskgraduatingmeeting","Is at risk of not graduating. Please schedule a meeting.","เสี่ยงต่อการไม่จบการศึกษา กรุณานัดหมายสำหรับการประชุม"
"failing","Is currently in danger of failing or is failing","ปัจจุบันนี้เสี่ยงต่อการสอบตก หรือกำลังจะสอบตก"
"grade-a","Is earning a grade of A in class","ได้เกรด A ในชั้นเรียน"
"grade-b","Is earning a grade of B in class","ได้เกรด B ในชั้นเรียน"
"grade-c","Is earning a grade of C in class","ได้เกรด C ในชั้นเรียน"
"grade-d","Is earning a grade of D in class","ได้เกรด D ในชั้นเรียน"
"grade-f","Is earning a grade of F in class","ได้เกรด F ในชั้นเรียน"
"leftclass","Left class without permission","ออกจากห้องเรียนโดยไม่ได้รับอนุญาต"
"losttextbook","Lost one or more textbooks","หนังสือเรียนหายหนึ่งเล่มหรือมากกว่านั้น"
"madenoises","Made inappropriate noises during a test","ส่งเสียงอันไม่สมควรในระหว่างการสอบ"
"saturdayschool","Must attend Saturday school","ต้องเข้ามาเรียนในวันเสาร์"
"test-friday","Must study for Friday's test","ต้องติวหนังสือสำหรับการสอบในวันศุกร์"
"test-monday","Must study for Monday's test","ต้องติวหนังสือสำหรับการสอบในวันจันทร์"
"test-nextfriday","Must study for next Friday's test","ต้องติวหนังสือสำหรับการสอบในวันศุกร์หน้า"
"test-nextmonday","Must study for next Monday's test","ต้องติวหนังสือสำหรับการสอบในวันจันทร์หน้า"
"test-nextthurday","Must study for next Thursday's test","ต้องติวหนังสือสำหรับการสอบในวันพฤหัสบดีหน้า"
"test-nexttuesday","Must study for next Tuesday's test","ต้องติวหนังสือสำหรับการสอบในวันอังคารหน้า"
"test-nextwednesday","Must study for next Wednesday's test","ต้องติวหนังสือสำหรับการสอบในวันพุธหน้า"
"test-thursday","Must study for Thursday's test","ต้องติวหนังสือสำหรับการสอบในวันพฤหัสบดี"
"test-tomorrow","Must study for tomorrow's test","ต้องติวหนังสือสำหรับการสอบในวันพรุ่งนี้"
"test-tuesday","Must study for Tuesday's test","ต้องติวหนังสือสำหรับการสอบในวันอังคาร"
"test-wednesday","Must study for Wednesday's test","ต้องติวหนังสือสำหรับการสอบในวันพุธ"
"fillplaner","Needs to fill out the daily planner","จำเป็นต้องกรอกแผนการทำงานประจำวัน"
"supplies","Needs to have supplies out and ready at the start of class","จำเป็นต้องนำอุปกรณ์การเรียนออกมา และเตรียมพร้อมเมื่อชั้นเรียนเริ่มต้น"
"improve-algebra","Needs to improve handwriting skills","จำเป็นต้องพัฒนาทักษะด้านลายมือ"
"improve-language","Needs to improve language skills","จำเป็นต้องพัฒนาทักษะด้านภาษา"
"improve-math","Needs to improve math skills","จำเป็นต้องพัฒนาทักษะด้านคณิตศาสตร์"
"improve-organizational","Needs to improve organizational skills","จำเป็นต้องพัฒนาทักษะด้านความเป็นระเบียบ"
"improve-spelling","Needs to improve spelling skills","จำเป็นต้องพัฒนาทักษะด้านการสะกดคำ"
"studytest","Needs to study for a test or quiz","จำเป็นต้องติวหนังสือสำหรับการสอบหรือการทดสอบความรู้"
"takenotes","Needs to take better notes in class","จำเป็นต้องมีการจดบันทึกการเรียนการสอนในชั้นให้ดีกว่านี้"
"wrokbetter","Needs to work better with others on a team","จำเป็นต้องร่วมทำงานเป็นทีมกับผู้อื่นให้ดีกว่านี้"
"participated","Participated well in class","มีส่วนร่วมในชั้นเรียนเป็นอย่างดี"
"testgrade-a","Received a grade of A on a test or quiz","ได้รับเกรด A ในการสอบหรือการทดสอบความรู้"
"testgrade-b","Received a grade of B on a test or quiz","ได้รับเกรด B ในการสอบหรือการทดสอบความรู้"
"testgrade-c","Received a grade of C on a test or quiz","ได้รับเกรด C ในการสอบหรือการทดสอบความรู้"
"testgrade-d","Received a grade of D on a test or quiz","ได้รับเกรด D ในการสอบหรือการทดสอบความรู้"
"testgrade-f","Received a grade of F on a test or quiz","ได้รับเกรด F ในการสอบหรือการทดสอบความรู้"
"lowtestscore","Received a low test score","ได้รับคะแนนสอบต่ำ"
"conferenceasap","Requires that a parent-teacher conference be scheduled as soon as possible. Please contact the teacher.","จำเป็นต้องมีการนัดหมายเพื่อประชุมผู้ปกครองและครูให้เร็วที่สุด กรุณาติดต่อคุณครู"
"conference","Requires that a parent-teacher conference be scheduled. Please contact the teacher.","จำเป็นต้องมีการนัดหมายเพื่อประชุมผู้ปกครองและครู กรุณาติดต่อคุณครู"
"scoreperfect","Scored perfectly on the test","ได้คะแนนสอบเต็ม"
"scoreverywell","Scored very well on the test","ได้คะแนนสอบดีมาก"
"scorewell","Scored well on the test","ได้คะแนนสอบดี"
"shared","Shared well with others","มีการแบ่งปันผู้อื่นเป็นอย่างดี"
"academicimprovement","Showed improvement in academic achievement","มีพัฒนาการในด้านความสัมฤทธิ์ผลทางการเรียน"
"behaviorimprovement","Showed improvement in behavior","มีพัฒนาการในด้านความประพฤติ"
"improvement","Showed improvement in behavior and academic achievement","มีพัฒนาการในด้านความประพฤติและความสัมฤทธิ์ผลทางการเรียน"
"slept","Slept in class today","วันนี้หลับในห้องเรียน"
"focused","Stays focused","ตั้งใจเรียน"
"focusedorganized","Stays focused and organized","ตั้งใจเรียนและมีระเบียบ"
"organized","Stays organized","มีระเบียบ"
"goodnoted","Takes good notes","จดบันทึกการเรียนการสอนได้ดี"
"mobile","Used a mobile phone or other electronic device inappropriately","ใช้โทรศัพท์มือถือหรืออุปกรณ์อิเล็กทรอนิกส์อื่นๆ อย่างไม่เหมาะสม"
"badlanguageclass","Used inappropriate language in class","ใช้ภาษาที่ไม่เหมาะสมในชั้นเรียน"
"badlanguagecampus","Used inappropriate language on campus","ใช้ภาษาที่ไม่เหมาะสมในบริเวณโรงเรียน"
"profanityclass","Used profanity in class ","ใช้ถ้อยคำหยาบคายในชั้นเรียน "
"profanitycampus","Used profanity on campus ","ใช้ถ้อยคำหยาบคายในบริเวณโรงเรียน "
"pleasureclass","Was a pleasure to have in class","มีความยินดีที่ได้มาอยู่ในชั้นเรียน"
"absent","Was absent","ขาดเรียน"
"absentmakeup","Was absent and needs to complete make up work","ขาดเรียนและจำเป็นต้องทำงานชดเชยให้เสร็จ"
"assignedproject","Was assigned a project, please check the due date with your child","ได้รับโครงงานหนึ่ง กรุณาตรวจสอบวันกำหนดส่งกับบุตรธิดาของท่าน"
"assigneddetention","Was assigned detention","ได้รับการคุมตัว"
"homeworkdue-friday","Was assigned homework that is due Friday","ได้รับการบ้านที่มีกำหนดส่งวันศุกร์"
"homeworkdue-monday","Was assigned homework that is due Monday","ได้รับการบ้านที่มีกำหนดส่งวันจันทร์"
"homeworkdue-nextfriday","Was assigned homework that is due next Friday","ได้รับการบ้านที่มีกำหนดส่งวันศุกร์หน้า"
"homeworkdue-nextmonday","Was assigned homework that is due next Monday","ได้รับการบ้านที่มีกำหนดส่งวันจันทร์หน้า"
"homeworkdue-nextthursday","Was assigned homework that is due next Thursday","ได้รับการบ้านที่มีกำหนดส่งวันพฤหัสบดีหน้า"
"homeworkdue-nexttuesday","Was assigned homework that is due next Tuesday","ได้รับการบ้านที่มีกำหนดส่งวันอังคารหน้า"
"homeworkdue-nextwednesday","Was assigned homework that is due next Wednesday","ได้รับการบ้านที่มีกำหนดส่งวันพุธหน้า"
"homeworkdue-thursday","Was assigned homework that is due Thursday","ได้รับการบ้านที่มีกำหนดส่งวันพฤหัสบดี"
"homeworkdue-tomorrow","Was assigned homework that is due tomorrow","ได้รับการบ้านที่มีกำหนดส่งวันพรุ่งนี้"
"homeworkdue-tuesday","Was assigned homework that is due Tuesday","ได้รับการบ้านที่มีกำหนดส่งวันอังคาร"
"homeworkdue-wednesday","Was assigned homework that is due Wednesday","ได้รับการบ้านที่มีกำหนดส่งวันพุธ"
"disrispectfulclassmates","Was disrespectful to classmates","ไม่สุภาพต่อเพื่อนร่วมชั้น"
"disrispectfulteacher","Was disrespectful to the teacher","ไม่สุภาพต่อคุณครู"
