"Messagekey","Comment","Comment"
"disruptiveevent","Was disruptive during a school event","ก่อความวุ่นวายระหว่างกิจกรรมของโรงเรียน"
"disruptiveclass","Was disruptive in class","ก่อความวุ่นวายในชั้นเรียน"
"disruptivefieldtrip","Was disruptive on the field trip","ก่อความวุ่นวายในระหว่างทัศนศึกษา"
"classpresident","Was elected class president","ได้รับเลือกให้เป็นประธานของชั้นเรียน"
"homeworkassignment","Was given a homework assignment","มีการบ้านที่มอบหมายให้"
"importantform","Was given an important form which must be returned","มีแบบฟอร์มสำคัญที่ให้ไปจำเป็นต้องส่งกลับคืน"
"importantletter","Was given an important letter which must be signed","มีจดหมายสำคัญที่ให้ไปจำเป็นต้องเซ็นต์รับทราบ"
"missingreadinglog","Was missing the reading log","ทำตารางจดรายละเอียดการอ่านหาย"
"notattentive","Was not attentive in class","ไม่ตั้งใจเรียนในห้องเรียน"
"inappropriatedressed","Was not dressed appropriately","แต่งตัวไม่เหมาะสม"
"notdressedpe","Was not dressed properly for P.E.","แต่งตัวไม่เหมาะสมสำหรับวิชาพลศึกษา"
"notpresentmakeup","Was not present in class and needs to complete make-up work","ไม่อยู่ในห้องเรียน และจำเป็นต้องทำงานชดเชยให้เสร็จ"
"gradingsheet-friday","Will have a grading sheet sent home Friday","จะมีการส่งใบรายงานคะแนนไปให้ทางบ้านในวันศุกร์"
"gradingsheet-monday","Will have a grading sheet sent home Monday","จะมีการส่งใบรายงานคะแนนไปให้ทางบ้านในวันจันทร์"
"gradingsheet-nextfriday","Will have a grading sheet sent home next Friday","จะมีการส่งใบรายงานคะแนนไปให้ทางบ้านในวันศุกร์หน้า"
"gradingsheet-nextmonday","Will have a grading sheet sent home next Monday","จะมีการส่งใบรายงานคะแนนไปให้ทางบ้านในวันจันทร์หน้า"
"gradingsheet-nextthursday","Will have a grading sheet sent home next Thursday","จะมีการส่งใบรายงานคะแนนไปให้ทางบ้านในวันพฤหัสบดีหน้า"
"gradingsheet-nexttuesday","Will have a grading sheet sent home next Tuesday","จะมีการส่งใบรายงานคะแนนไปให้ทางบ้านในวันอังคารหน้า"
"gradingsheet-nextwednesday","Will have a grading sheet sent home next Wednesday","จะมีการส่งใบรายงานคะแนนไปให้ทางบ้านในวันพุธหน้า"
"gradingsheet-thursday","Will have a grading sheet sent home Thursday","จะมีการส่งใบรายงานคะแนนไปให้ทางบ้านในวันพฤหัสบดี"
"gradingsheet-tuesday","Will have a grading sheet sent home Tuesday","จะมีการส่งใบรายงานคะแนนไปให้ทางบ้านในวันอังคาร"
"gradingsheet-wednesday","Will have a grading sheet sent home Wednesday","จะมีการส่งใบรายงานคะแนนไปให้ทางบ้านในวันพุธ"
"reportcard-friday","Will have a report card sent home Friday","จะมีการส่งสมุดรายงานผลการเรียนไปให้ทางบ้านในวันศุกร์"
"reportcard-monday","Will have a report card sent home Monday","จะมีการส่งสมุดรายงานผลการเรียนไปให้ทางบ้านในวันจันทร์"
"reportcard-nextfriday","Will have a report card sent home next Friday","จะมีการส่งสมุดรายงานผลการเรียนไปให้ทางบ้านในวันศุกร์หน้า"
"reportcard-nextmonday","Will have a report card sent home next Monday","จะมีการส่งสมุดรายงานผลการเรียนไปให้ทางบ้านในวันจันทร์หน้า"
"reportcard-nextthursday","Will have a report card sent home next Thursday","จะมีการส่งสมุดรายงานผลการเรียนไปให้ทางบ้านในวันพฤหัสบดีหน้า"
"reportcard-nexttuesday","Will have a report card sent home next Tuesday","จะมีการส่งสมุดรายงานผลการเรียนไปให้ทางบ้านในวันอังคารหน้า"
"reportcard-nextwednesday","Will have a report card sent home next Wednesday","จะมีการส่งสมุดรายงานผลการเรียนไปให้ทางบ้านในวันพุธหน้า"
"reportcard-thursday","Will have a report card sent home Thursday","จะมีการส่งสมุดรายงานผลการเรียนไปให้ทางบ้านในวันพฤหัสบดี"
"reportcard-tuesday","Will have a report card sent home Tuesday","จะมีการส่งสมุดรายงานผลการเรียนไปให้ทางบ้านในวันอังคาร"
"reportcard-wednesday","Will have a report card sent home Wednesday","จะมีการส่งสมุดรายงานผลการเรียนไปให้ทางบ้านในวันพุธ"
"inappropriateclothing","Wore inappropriate clothing","สวมเสื้อผ้าที่ไม่เหมาะสม"
"wrokedwell","Worked well with others on a team","ทำงานร่วมกันผู้ือื่นเป็นทีมได้เป็นอย่างดี"
"worksefficiently","Works efficiently","ทำงานอย่างมีประสิทธิภาพ"
