"Messagekey","Comment","Comment"
"gradingsheet-nextmonday","Will have a grading sheet sent home next Monday","Θα σταλεί ένα δελτίο βαθμολογίας στο σπίτι του/της την επόμενη Δευτέρα"
"gradingsheet-nextthursday","Will have a grading sheet sent home next Thursday","Θα σταλεί ένα δελτίο βαθμολογίας στο σπίτι του/της την επόμενη Πέμπτη"
"gradingsheet-nexttuesday","Will have a grading sheet sent home next Tuesday","Θα σταλεί ένα δελτίο βαθμολογίας στο σπίτι του/της την επόμενη Τρίτη"
"gradingsheet-nextwednesday","Will have a grading sheet sent home next Wednesday","Θα σταλεί ένα δελτίο βαθμολογίας στο σπίτι του/της την επόμενη Τετάρτη"
"gradingsheet-thursday","Will have a grading sheet sent home Thursday","Θα σταλεί ένα δελτίο βαθμολογίας στο σπίτι του/της την Πέμπτη"
"gradingsheet-tuesday","Will have a grading sheet sent home Tuesday","Θα σταλεί ένα δελτίο βαθμολογίας στο σπίτι του/της την Τρίτη"
"gradingsheet-wednesday","Will have a grading sheet sent home Wednesday","Θα σταλεί ένα δελτίο βαθμολογίας στο σπίτι του/της την Τετάρτη"
"reportcard-friday","Will have a report card sent home Friday","Θα σταλεί ένας έλεγχος προόδου στο σπίτι του/της την Παρασκευή"
"reportcard-monday","Will have a report card sent home Monday","Θα σταλεί ένας έλεγχος προόδου στο σπίτι του/της τη Δευτέρα"
"reportcard-nextfriday","Will have a report card sent home next Friday","Θα σταλεί ένας έλεγχος προόδου στο σπίτι του/της την επόμενη Παρασκευή"
"reportcard-nextmonday","Will have a report card sent home next Monday","Θα σταλεί ένας έλεγχος προόδου στο σπίτι του/της την επόμενη Δευτέρα"
"reportcard-nextthursday","Will have a report card sent home next Thursday","Θα σταλεί ένας έλεγχος προόδου στο σπίτι του/της την επόμενη Πέμπτη"
"reportcard-nexttuesday","Will have a report card sent home next Tuesday","Θα σταλεί ένας έλεγχος προόδου στο σπίτι του/της την επόμενη Τετάρτη"
"reportcard-nextwednesday","Will have a report card sent home next Wednesday","Θα σταλεί ένας έλεγχος προόδου στο σπίτι του/της την επόμενη Παρασκευή"
"reportcard-thursday","Will have a report card sent home Thursday","Θα σταλεί ένας έλεγχος προόδου στο σπίτι του/της την Πέμπτη"
"reportcard-tuesday","Will have a report card sent home Tuesday","Θα σταλεί ένας έλεγχος προόδου στο σπίτι του/της την Τρίτη"
"reportcard-wednesday","Will have a report card sent home Wednesday","Θα σταλεί ένας έλεγχος προόδου στο σπίτι του/της την Τετάρτη"
"inappropriateclothing","Wore inappropriate clothing","Φορούσε ακατάλληλα ρούχα"
"wrokedwell","Worked well with others on a team","Συνεργάστηκε καλά με τα άλλα παιδιά σε μια ομάδα"
"worksefficiently","Works efficiently","Εργάζεται με αποδοτικό τρόπο"
